Component,Publication Grant Number,Publication Doi,Publication Journal,Pubmed Id,Pubmed Url,Publication Title,Publication Year,Publication Keywords,Publication Authors,Publication Abstract,Publication Assay,Publication Tumor Type,Publication Tissue,Publication Dataset Alias,Publication Accessibility,Publication Tumor Type.1,tool,Unnamed: 19,PublicationView_id
PublicationView,CA235747,10.1007/s10555-023-10109-y,Cancer Metastasis Rev,37286865,https://pubmed.ncbi.nlm.nih.gov/37286865,Epigenetic markers and therapeutic targets for metastasis,2023,"Plasticity, Metastasis, Circulating Tumor Cells, Epigenetic Biomarkers, Epi-drugs","Carolyn J Kravitz, Qin Yan, Don X Nguyen","The last few years have seen an increasing number of discoveries which collectively demonstrate that histone and DNA modifying enzyme modulate different stages of metastasis. Moreover, epigenomic alterations can now be measured at multiple scales of analysis and are detectable in human tumors or liquid biopsies. Malignant cell clones with a proclivity for relapse in certain organs may arise in the primary tumor as a consequence of epigenomic alterations which cause a loss in lineage integrity. These alterations may occur due to genetic aberrations acquired during tumor progression or concomitant to therapeutic response. Moreover, evolution of the stroma can also alter the epigenome of cancer cells. In this review, we highlight current knowledge with a particular emphasis on leveraging chromatin and DNA modifying mechanisms as biomarkers of disseminated disease and as therapeutic targets to treat metastatic cancers.",Targeted Therapy Agent,Pan-cancer,Not Applicable,Not Appicable,Open Access,,,,37286865
PublicationView,"CA268069, CA210190",10.1016/j.xpro.2023.102135,STAR Protoc,36861840,https://pubmed.ncbi.nlm.nih.gov/36861840,Protocol to culture and image pancreatic ductal adenocarcinoma tumor slices to study T¬†cell migration,2023,"Cell biology, Cancer, Microscopy, immunology","Nelson J Rodr√≠guez-Merced, Mackenzie K Callaway, Paolo P Provenzano","Here, we describe a protocol for culture and live cell imaging of tumor slices. This approach studies carcinoma and immune cell dynamics in complex tumor microenvironments (TME) with nonlinear optical imaging platforms. Using a tumor-bearing mouse model of pancreatic ductal adenocarcinoma (PDA), we detail steps to isolate, activate, and label CD8<sup>+</sup> T lymphocytes and later introduce them to live murine PDA tumor slice explants. The techniques described in this protocol can improve our understanding of cell migration in complex microenvironments ex¬†vivo. For complete details on the use and execution of this protocol, please refer to Tabdanov et¬†al. (2021).<sup>1</sup>.","Imaging, Time Lapse Microscopy",Pancreatic Ductal Adenocarcinoma,Pancreas,Not Appicable,Open Access,,,,36861840
PublicationView,CA232161,10.1038/s41467-023-42445-6,Nat Commun,37853017,https://pubmed.ncbi.nlm.nih.gov/37853017,Paired yeast one-hybrid assays to detect DNA-binding cooperativity and antagonism across transcription factors,2023,,"Anna Berenson, Ryan Lane, Luis F Soto-Ugaldi, Mahir Patel, Cosmin Ciausu, Zhaorong Li, Yilin Chen, Sakshi Shah, Clarissa Santoso, Xing Liu, Kerstin Spirohn, Tong Hao, David E Hill, Marc Vidal, Juan I Fuxman Bass","Cooperativity and antagonism between transcription factors (TFs) can drastically modify their binding to regulatory DNA elements. While mapping these relationships between TFs is important for understanding their context-specific functions, existing approaches either rely on DNA binding motif predictions, interrogate one TF at a time, or study individual TFs in parallel. Here, we introduce paired yeast one-hybrid (pY1H) assays to detect cooperativity and antagonism across hundreds of TF-pairs at DNA regions of interest. We provide evidence that a wide variety of TFs are subject to modulation by other TFs in a DNA region-specific manner. We also demonstrate that TF-TF relationships are often affected by alternative isoform usage and identify cooperativity and antagonism between human TFs and viral proteins from human papillomaviruses, Epstein-Barr virus, and other viruses. Altogether, pY1H assays provide a broadly applicable framework to study how different functional relationships affect protein occupancy at regulatory DNA regions.","DNA Sequencing, ChIP-Seq",Pan-cancer,Not Applicable,PRJNA1015222,Open Access,,,,37853017
PublicationView,CA241927,10.1016/j.ygeno.2023.110671,Genomics,37353093,https://pubmed.ncbi.nlm.nih.gov/37353093,"Spatial transcriptomics: Technologies, applications and experimental considerations",2023,"Rna Sequencing, Spatial Transcriptomics, Merfish, Geomx Dsp, Stereo-seq, Cosmx Smi, Xienum, 10√ó Visium, Bmkmanu S1000","Ye Wang, Bin Liu, Gexin Zhao, YooJin Lee, Anton Buzdin, Xiaofeng Mu, Joseph Zhao, Hong Chen, Xinmin Li","The diverse cell types of an organ have a highly structured organization to enable their efficient and correct function. To fully appreciate gene functions in a given cell type, one needs to understand how much, when and where the gene is expressed. Classic bulk RNA sequencing and popular single cell sequencing destroy cell structural organization and fail to provide spatial information. However, the spatial location of gene expression or of the cell in a complex tissue provides key clues to comprehend how the neighboring genes or cells cross talk, transduce signals and work together as a team to complete the job. The functional requirement for the spatial content has been a driving force for rapid development of the spatial transcriptomics technologies in the past few years. Here, we present an overview of current spatial technologies with a special focus on the commercially available or currently being commercialized technologies, highlight their applications by category and discuss experimental considerations for a first spatial experiment.","Visium Spatial Gene Expression, Multiplexed Error-Robust Fluorescence In Situ Hybridization",Pan-cancer,Not Applicable,Not Appicable,Open Access,,,,37353093
PublicationView,CA243072,10.3324/haematol.2023.283225,Haematologica,37439336,https://pubmed.ncbi.nlm.nih.gov/37439336,Down syndrome and leukemia: from basic mechanisms to clinical advances,2023,,"Andre Baruchel, Jean-Pierre Bourquin, John Crispino, Sergi Cuartero, Henrik Hasle, Johann Hitzler, Jan-Henning Klusmann, Shai Izraeli, Andrew A Lane, Sebastien Malinge, Karen R Rabin, Irene Roberts, Sandra Ryeom, Sarah K Tasian, Elvin Wagenblast","Children with Down syndrome (DS, trisomy 21) are at a significantly higher risk of developing acute leukemia compared to the overall population. Many studies investigating the link between trisomy 21 and leukemia initiation and progression have been conducted over the last two decades. Despite improved treatment regimens and significant progress in iden - tifying genes on chromosome 21 and the mechanisms by which they drive leukemogenesis, there is still much that is unknown. A focused group of scientists and clinicians with expertise in leukemia and DS met in October 2022 at the J√©r√¥me Lejeune Foundation in Paris, France for the 1st International Symposium on Down Syndrome and Leukemia. This meeting was held to discuss the most recent advances in treatment regimens and the biology underlying the initiation, progression, and relapse of acute lymphoblastic leukemia and acute myeloid leukemia in children with DS. This review provides a summary of what is known in the field, challenges in the management of DS patients with leukemia, and key questions in the field.",Modeling,"B Acute Lymphoblastic Leukemia, Acute Lymphoblastic Leukemia, Myeloid Leukemia",Blood,Not Appicable,Open Access,,,,37439336
PublicationView,CA209975,10.1158/0008-5472.can-23-0153,Cancer Res,37526524,https://pubmed.ncbi.nlm.nih.gov/37526524,The Ratio of Key Metabolic Transcripts Is a Predictive Biomarker of Breast Cancer Metastasis to the Lung,2023,,"Deepti Mathur, Chen Liao, Wendy Lin, Alessandro La Ferlita, Salvatore Alaimo, Samuel Taylor, Yi Zhong, Christine Iacobuzio-Donahue, Alfredo Ferro, Joao B Xavier","Understanding the rewired metabolism underlying organ-specific metastasis in breast cancer could help identify strategies to improve the treatment and prevention of metastatic disease. Here, we used a systems biology approach to compare metabolic fluxes used by parental breast cancer cells and their brain- and lung-homing derivatives. Divergent lineages had distinct, heritable metabolic fluxes. Lung-homing cells maintained high glycolytic flux despite low levels of glycolytic intermediates, constitutively activating a pathway sink into lactate. This strong Warburg effect was associated with a high ratio of lactate dehydrogenase (LDH) to pyruvate dehydrogenase (PDH) expression, which correlated with lung metastasis in patients with breast cancer. Although feature classification models trained on clinical characteristics alone were unable to predict tropism, the LDH/PDH ratio was a significant predictor of metastasis to the lung but not to other organs, independent of other transcriptomic signatures. High lactate efflux was also a trait in lung-homing metastatic pancreatic cancer cells, suggesting that lactate production may be a convergent phenotype in lung metastasis. Together, these analyses highlight the essential role that metabolism plays in organ-specific cancer metastasis and identify a putative biomarker for predicting lung metastasis in patients with breast cancer. Significance: Lung-homing metastatic breast cancer cells express an elevated ratio of lactate dehydrogenase to pyruvate dehydrogenase, indicating that ratios of specific metabolic gene transcripts have potential as metabolic biomarkers for predicting organ-specific metastasis.","Cell Culture, ELISA, Gas Chromatography Mass Spectrometry",Breast Neoplasm,Not Applicable,Not Appicable,Open Access,,,,37526524
PublicationView,CA215845,10.1016/j.ccell.2020.12.014,Cancer Cell,33482121,https://pubmed.ncbi.nlm.nih.gov/33482121,Patterns of transcription factor programs and immune pathway activation define four major subtypes of SCLC with distinct therapeutic vulnerabilities,2021,"Neuroendocrine, Emt, SCLC, Ascl1, Intratumoral Heterogeneity, Neurod1, Pou2f3","Carl M Gay, C Allison Stewart, Elizabeth M Park, Lixia Diao, Sarah M Groves, Simon Heeke, Barzin Y Nabet, Junya Fujimoto, Luisa M Solis, Wei Lu, Yuanxin Xi, Robert J Cardnell, Qi Wang, Giulia Fabbri, Kasey R Cargill, Natalie I Vokes, Kavya Ramkumar, Bingnan Zhang, Carminia M Della Corte, Paul Robson, Stephen G Swisher, Jack A Roth, Bonnie S Glisson, David S Shames, Ignacio I Wistuba, Jing Wang, Vito Quaranta, John Minna, John V Heymach, Lauren Averett Byers","Despite molecular and clinical heterogeneity, small cell lung cancer (SCLC) is treated as a single entity with predictably poor results. Using tumor expression data and non-negative matrix factorization, we identify four SCLC subtypes defined largely by differential expression of transcription factors ASCL1, NEUROD1, and POU2F3 or low expression of all three transcription factor signatures accompanied by an Inflamed gene signature (SCLC-A, N, P, and I, respectively). SCLC-I experiences the greatest benefit from the addition of immunotherapy to chemotherapy, while the other subtypes each have distinct vulnerabilities, including to inhibitors of PARP, Aurora kinases, or BCL-2. Cisplatin treatment of SCLC-A patient-derived xenografts induces intratumoral shifts toward SCLC-I, supporting subtype switching as a mechanism of acquired platinum resistance. We propose that matching baseline tumor subtype to therapy, as well as manipulating subtype switching on therapy, may enhance depth and duration of response for SCLC patients.","Western Blotting, Flow Cytometry, Single Cell RNA-Sequencing",Lung Small Cell Carcinoma,Lung,"GSE151904, GSE138474",Open Access,,,,33482121
PublicationView,CA217450,10.3389/fimmu.2022.936129,Front Immunol,36059502,https://pubmed.ncbi.nlm.nih.gov/36059502,MuSyC dosing of adjuvanted cancer vaccines optimizes antitumor responses,2022,"Cancer vaccine, Antigen presenting cell, Activation Markers, T-cell Priming, Tlr7/8 Agonist, Sting Agonists, Antitumor/cytotoxic Activity, Multidimensional Synergy Of Combinations (Musyc)","David Taylor, Christian T Meyer, Diana Graves, Rupashree Sen, Juan Fu, Emily Tran, Bilal Mirza, Gabriel Rodriguez, Cara Lang, Hanwen Feng, Vito Quaranta, John T Wilson, Young J Kim, Michael J Korrer","With the clinical approval of T-cell-dependent immune checkpoint inhibitors for many cancers, therapeutic cancer vaccines have re-emerged as a promising immunotherapy. Cancer vaccines require the addition of immunostimulatory adjuvants to increase vaccine immunogenicity, and increasingly multiple adjuvants are used in combination to bolster further and shape cellular immunity to tumor antigens. However, rigorous quantification of adjuvants' synergistic interactions is challenging due to partial redundancy in costimulatory molecules and cytokine production, leading to the common assumption that combining both adjuvants at the maximum tolerated dose results in optimal efficacy. Herein, we examine this maximum dose assumption and find combinations of these doses are suboptimal. Instead, we optimized dendritic cell activation by extending the Multidimensional Synergy of Combinations (MuSyC) framework that measures the synergy of efficacy and potency between two vaccine adjuvants. Initially, we performed a preliminary <i>in vitro</i> screening of clinically translatable adjuvant receptor targets (TLR, STING, NLL, and RIG-I). We determined that STING agonist (CDN) plus TLR4 agonist (MPL-A) or TLR7/8 agonist (R848) as the best pairwise combinations for dendritic cell activation. In addition, we found that the combination of R848 and CDN is synergistically efficacious and potent in activating both murine and human antigen-presenting cells (APCs) <i>in vitro</i>. These two selected adjuvants were then used to estimate a MuSyC-dose optimized for <i>in vivo</i> T-cell priming using ovalbumin-based peptide vaccines. Finally, using B16 melanoma and MOC1 head and neck cancer models, MuSyC-dose-based adjuvating of cancer vaccines improved the antitumor response, increased tumor-infiltrating lymphocytes, and induced novel myeloid tumor infiltration changes. Further, the MuSyC-dose-based adjuvants approach did not cause additional weight changes or increased plasma cytokine levels compared to CDN alone. Collectively, our findings offer a proof of principle that our MuSyC-extended approach can be used to optimize cancer vaccine formulations for immunotherapy.","Flow Cytometry, In Vitro Cell Killing Assay","Head and Neck Squamous Cell Carcinoma, Melanoma, Acute Monocytic Leukemia",Not Applicable,Not Appicable,Open Access,,,,36059502
PublicationView,CA209971,10.1038/s41586-019-0988-7,Nature,30814731,https://pubmed.ncbi.nlm.nih.gov/30814731,Structure of the IFNŒ≥ receptor complex guides design of biased agonists,2019,,"Juan L Mendoza, Nichole K Escalante, Kevin M Jude, Junel Sotolongo Bellon, Leon Su, Tim M Horton, Naotaka Tsutsumi, Steven J Berardinelli, Robert S Haltiwanger, Jacob Piehler, Edgar G Engleman, K Christopher Garcia","The cytokine interferon-Œ≥ (IFNŒ≥) is a central coordinator of innate and adaptive immunity, but its highly pleiotropic actions have diminished its prospects for use as an immunotherapeutic agent. Here, we took a structure-based approach to decoupling IFNŒ≥ pleiotropy. We engineered an affinity-enhanced variant of the ligand-binding chain of the IFNŒ≥ receptor IFNŒ≥R1, which enabled us to determine the crystal structure of the complete hexameric (2:2:2) IFNŒ≥-IFNŒ≥R1-IFNŒ≥R2 signalling complex at 3.25¬†√Ö resolution. The structure reveals the mechanism underlying deficits in IFNŒ≥ responsiveness in mycobacterial disease syndrome resulting from a T168N mutation in IFNŒ≥R2, which impairs assembly of the full signalling complex. The topology of the hexameric complex offers a blueprint for engineering IFNŒ≥ variants to tune IFNŒ≥ receptor signalling output. Unexpectedly, we found that several partial IFNŒ≥ agonists exhibited biased gene-expression profiles. These biased agonists retained the ability to induce upregulation of major histocompatibility complex class I antigen expression, but exhibited impaired induction of programmed death-ligand 1 expression in a wide range of human cancer cell lines, offering a route to decoupling immunostimulatory and immunosuppressive functions of IFNŒ≥ for therapeutic applications.","Mass Spectrometry, Next Generation Sequencing, Surface Plasmon Resonance",Pan-cancer,Not Applicable,GSE122672,Open Access,,,,30814731
PublicationView,CA253248,10.1126/sciadv.abe4362,Sci Adv,33762337,https://pubmed.ncbi.nlm.nih.gov/33762337,Lymphangiogenesis-inducing vaccines elicit potent and long-lasting T cell immunity against melanomas,2021,,"Maria Stella Sasso, Nikolaos Mitrousis, Yue Wang, Priscilla S Briquez, Sylvie Hauert, Jun Ishihara, Jeffrey A Hubbell, Melody A Swartz","In melanoma, the induction of lymphatic growth (lymphangiogenesis) has long been correlated with metastasis and poor prognosis, but we recently showed it can synergistically enhance cancer immunotherapy and boost T cell immunity. Here, we develop a translational approach for exploiting this ""lymphangiogenic potentiation"" of immunotherapy in a cancer vaccine using lethally irradiated tumor cells overexpressing vascular endothelial growth factor C (VEGF-C) and topical adjuvants. Our ""VEGFC vax"" induced extensive local lymphangiogenesis and promoted stronger T cell activation in both the intradermal vaccine site and draining lymph nodes, resulting in higher frequencies of antigen-specific T cells present systemically than control vaccines. In mouse melanoma models, VEGFC vax elicited potent tumor-specific T cell immunity and provided effective tumor control and long-term immunological memory. Together, these data introduce the potential of lymphangiogenesis induction as a novel immunotherapeutic strategy to consider in cancer vaccine design.","Flow Cytometry, Immunohistochemistry Staining Method, RT-qPCR",Melanoma,Skin ,Not Applicable,Open Access,,,,33762337
PublicationView,CA224012,10.1016/j.tranon.2023.101662,Transl Oncol,37004490,https://pubmed.ncbi.nlm.nih.gov/37004490,A Novel 3DNA¬Æ Nanocarrier effectively delivers payloads to pancreatic tumors,2023,"Pancreatic cancer, Active Targeting, Sirna Delivery, Nanotherapy","Grace A McCarthy, Aditi Jain, Roberto Di Niro, Christopher W Schultz, Wei Jiang, Charles J Yeo, Jessica Bowers, Jennifer Finan, Kelly Rhodes, Lou Casta, Vivi Hou, Anthony Stefanoni, Samantha Z Brown, Avinoam Nevler, Lebaron C Agostini, Lori Getts, Robert Getts, Jonathan R Brody","Introduction: Standard-of-care systemic chemotherapies for pancreatic ductal adenocarcinoma (PDAC) currently have limited clinical benefits, in addition to causing adverse side effects in many patients. One factor known to contribute to the poor chemotherapy response is the poor drug diffusion into PDAC tumors. Novel treatment methods are therefore drastically needed to improve targeted delivery of treatments. Here, we evaluated the efficacy of the 3DNA¬Æ Nanocarrier (3DNA) platform to direct delivery of therapeutics to PDAC tumors in vivo. Materials and methods: A panel of PDAC cell lines and a patient tissue microarray were screened for established tumor-specific proteins to identify targeting moieties for active targeting of the 3DNA. NRG mice with or without orthotopic MIA PaCa-2-luciferase PDAC tumors were treated intraperitoneally with 100 Œºl of fluorescently labeled 3DNA. Results: Folic acid and transferrin receptors were significantly elevated in PDAC compared to normal pancreas. Accordingly, both folic acid- and transferrin-conjugated 3DNA treatments significantly increased delivery of 3DNA specifically to tumors in comparison to unconjugated 3DNA treatment. In the absence of tumors, there was an increased clearance of both folic acid-conjugated 3DNA and unconjugated 3DNA, compared to the clearance rate in tumor-bearing mice. Lastly, delivery of siLuciferase by folic acid-conjugated 3DNA in an orthotopic model of luciferase-expressing PDAC showed significant and prolonged suppression of luciferase protein expression and activity. Conclusion: Our study progresses the 3DNA technology as a reliable and effective treatment delivery platform for targeted therapeutic approaches in PDAC.","Luciferase Reporter Assay, qPCR, Immunohistochemistry Staining Method",Pancreatic Ductal Adenocarcinoma,Not Applicable,Not Applicable,Open Access,,,,37004490
PublicationView,CA263001,10.1038/s41586-023-05960-6,Nature,37076619,https://pubmed.ncbi.nlm.nih.gov/37076619,Dedifferentiation maintains melanocyte stem cells in a dynamic niche,2023,,"Qi Sun, Wendy Lee, Hai Hu, Tatsuya Ogawa, Sophie De Leon, Ioanna Katehis, Chae Ho Lim, Makoto Takeo, Michael Cammer, M Mark Taketo, Denise L Gay, Sarah E Millar, Mayumi Ito","For unknow reasons, the melanocyte stem cell (McSC) system fails earlier than other adult stem cell populations<sup>1</sup>, which leads to hair greying in most humans and mice<sup>2,3</sup>. Current dogma states that McSCs are reserved in an undifferentiated state in the hair follicle niche, physically segregated from differentiated progeny that migrate away following cues of regenerative stimuli<sup>4-8</sup>. Here we show that most McSCs toggle between transit-amplifying and stem cell states for both self-renewal and generation of mature progeny, a mechanism fundamentally distinct from those of other self-renewing systems. Live imaging and single-cell RNA sequencing revealed that McSCs are mobile, translocating between hair follicle stem cell and transit-amplifying compartments where they reversibly enter distinct differentiation states governed by local microenvironmental cues (for example, WNT). Long-term lineage tracing demonstrated that the McSC system is maintained by reverted McSCs rather than by reserved stem cells inherently exempt from reversible changes. During ageing, there is accumulation of stranded McSCs that do not contribute to the regeneration of melanocyte progeny. These results identify a new model whereby dedifferentiation is integral to homeostatic stem cell maintenance and suggest that modulating McSC mobility may represent a new approach for the prevention of hair greying.","Imaging, Immunofluorescent Staining Method, In Situ Hybridization, Microscopy, Single Cell RNA-Sequencing, Gene Set Enrichment Analysis",Melanoma,Skin,"GSE203051,  GSE113502",Open Access,,,,37076619
PublicationView,CA238728,10.4049/jimmunol.2200697,J Immunol,36881866,https://pubmed.ncbi.nlm.nih.gov/36881866,Type 2 Dendritic Cells Orchestrate a Local Immune Circuit to Confer Antimetastatic Immunity,2023,,"Orr-El Weizman, Sophia Luyten, Irina Krykbaeva, Eric Song, Tianyang Mao, Marcus Bosenberg, Akiko Iwasaki","The progression of transformed primary tumors to metastatic colonization is a lethal determinant of disease outcome. Although circulating adaptive and innate lymphocyte effector responses are required for effective antimetastatic immunity, whether tissue-resident immune circuits confer initial immunity at sites of metastatic dissemination remains ill defined. Here we examine the nature of local immune cell responses during early metastatic seeding in the lung using intracardiac injection to mimic monodispersed metastatic spread. Using syngeneic murine melanoma and colon cancer models, we demonstrate that lung-resident conventional type 2 dendritic cells (DC2) orchestrate a local immune circuit to confer host antimetastatic immunity. Tissue-specific ablation of lung DC2, and not peripheral DC populations, led to increased metastatic burden in the presence of an intact T cell and NK cell compartment. We demonstrate that DC nucleic acid sensing and transcription factors IRF3 and IRF7 signaling are required for early metastatic control and that DC2 serve as a robust source of proinflammatory cytokines in the lung. Critically, DC2 direct the local production of IFN-Œ≥ by lung-resident NK cells, which limits the initial metastatic burden. Collectively, our results highlight, to our knowledge, a novel DC2-NK cell axis that colocalizes around pioneering metastatic cells to orchestrate an early innate immune response program to limit initial metastatic burden in the lung.","Microscopy, Flow Cytometry",Melanoma,Skin,Not Applicable,Open Access,,,,36881866
