Component,Publication Grant Number,Publication Doi,Publication Journal,Pubmed Id,Pubmed Url,Publication Title,Publication Year,Publication Keywords,Publication Authors,Publication Abstract,Publication Assay,Publication Tumor Type,Publication Tissue,Publication Dataset Alias,Publication Accessibility,Publication Tumor Type.1,tool,Unnamed: 19,PublicationView_id
PublicationView,"CA209988, CA253472",10.1038/s41420-023-01586-9,Cell Death Discov,37542044,https://pubmed.ncbi.nlm.nih.gov/37542044,Single-cell trajectory analysis reveals a CD9 positive state to contribute to exit from stem cell-like and embryonic diapause states and transit to drug-resistant states,2023,,"Xi Li, Alfonso Poire, Kang Jin Jeong, Dong Zhang, Gang Chen, Chaoyang Sun, Gordon B Mills","Bromo- and extra-terminal domain (BET) inhibitors (BETi) have been shown to decrease tumor growth in preclinical models and clinical trials. However, toxicity and rapid emergence of resistance have limited their clinical implementation. To identify state changes underlying acquisition of resistance to the JQ1 BETi, we reanalyzed single-cell RNAseq data from JQ1 sensitive and resistant SUM149 and SUM159 triple-negative breast cancer cell lines. Parental and JQ1-resistant SUM149 and SUM159 exhibited a stem cell-like and embryonic diapause (SCLED) cell state as well as a transitional cell state between the SCLED state that is present in both treatment naïve and JQ1 treated cells, and a number of JQ1 resistant cell states. A transitional cell state transcriptional signature but not a SCLED state transcriptional signature predicted worsened outcomes in basal-like breast cancer patients suggesting that transit from the SCLED state to drug-resistant states contributes to patient outcomes. Entry of SUM149 and SUM159 into the transitional cell state was characterized by elevated expression of the CD9 tetraspanin. Knockdown or inhibition of CD9-sensitized cells to multiple targeted and cytotoxic drugs in vitro. Importantly, CD9 knockdown or blockade sensitized SUM149 to JQ1 in vivo by trapping cells in the SCLED state and limiting transit to resistant cell states. Thus, CD9 appears to be critical for the transition from a SCLED state into treatment-resistant cell states and warrants exploration as a therapeutic target in basal-like breast cancer.","Single Cell ATAC-Seq, Single Cell RNA-Sequencing",,Breast,"GSE131102, GSE157220, GSE123837, GSE162798, GSE154927, GSE150949, GSE118390, GSE221183.",Open Access,"Breast Adenocarcinoma, Triple-Negative Breast Carcinoma",,,37542044
PublicationView,"CA274502, CA209891",10.1016/j.cels.2023.04.007,Cell Syst,37220749,https://pubmed.ncbi.nlm.nih.gov/37220749,A multi-scale map of protein assemblies in the DNA damage response,2023,"Visualization, systems biology, Dna Damage Response, Protein Networks, Double-strand Break Repair, Single-strand Break Repair, Multi-omics, Protein Assemblies","Anton Kratz, Minkyu Kim, Marcus R Kelly, Fan Zheng, Christopher A Koczor, Jianfeng Li, Keiichiro Ono, Yue Qin, Christopher Churas, Jing Chen, Rudolf T Pillich, Jisoo Park, Maya Modak, Rachel Collier, Kate Licon, Dexter Pratt, Robert W Sobol, Nevan J Krogan, Trey Ideker","The DNA damage response (DDR) ensures error-free DNA replication and transcription and is disrupted in numerous diseases. An ongoing challenge is to determine the proteins orchestrating DDR and their organization into complexes, including constitutive interactions and those responding to genomic insult. Here, we use multi-conditional network analysis to systematically map DDR assemblies at multiple scales. Affinity purifications of 21 DDR proteins, with/without genotoxin exposure, are combined with multi-omics data to reveal a hierarchical organization of 605 proteins into 109 assemblies. The map captures canonical repair mechanisms and proposes new DDR-associated proteins extending to stress, transport, and chromatin functions. We find that protein assemblies closely align with genetic dependencies in processing specific genotoxins and that proteins in multiple assemblies typically act in multiple genotoxin responses. Follow-up by DDR functional readouts newly implicates 12 assembly members in double-strand-break repair. The DNA damage response assemblies map is available for interactive visualization and query (ccmi.org/ddram/).","Mass Spectrometry, Proteomics Assay",,Not Applicable,"PXD028064, PXD037494",Open Access,Pan-cancer,,,37220749
PublicationView,CA235747,10.1016/j.ccell.2023.07.005,Cancer Cell,37541244,https://pubmed.ncbi.nlm.nih.gov/37541244,Mammalian SWI/SNF chromatin remodeling complexes promote tyrosine kinase inhibitor resistance in EGFR-mutant lung cancer,2023,,"Fernando J de Miguel, Claudia Gentile, William W Feng, Shannon J Silva, Akshay Sankar, Francisco Exposito, Wesley L Cai, Mary Ann Melnick, Camila Robles-Oteiza, Madeline M Hinkley, Jeanelle A Tsai, Antja-Voy Hartley, Jin Wei, Anna Wurtz, Fangyong Li, Maria I Toki, David L Rimm, Robert Homer, Craig B Wilen, Andrew Z Xiao, Jun Qi, Qin Yan, Don X Nguyen, Pasi A Jänne, Cigall Kadoch, Katerina A Politi","Acquired resistance to tyrosine kinase inhibitors (TKI), such as osimertinib used to treat EGFR-mutant lung adenocarcinomas, limits long-term efficacy and is frequently caused by non-genetic mechanisms. Here, we define the chromatin accessibility and gene regulatory signatures of osimertinib sensitive and resistant EGFR-mutant cell and patient-derived models and uncover a role for mammalian SWI/SNF chromatin remodeling complexes in TKI resistance. By profiling mSWI/SNF genome-wide localization, we identify both shared and cancer cell line-specific gene targets underlying the resistant state. Importantly, genetic and pharmacologic disruption of the SMARCA4/SMARCA2 mSWI/SNF ATPases re-sensitizes a subset of resistant models to osimertinib via inhibition of mSWI/SNF-mediated regulation of cellular programs governing cell proliferation, epithelial-to-mesenchymal transition, epithelial cell differentiation, and NRF2 signaling. These data highlight the role of mSWI/SNF complexes in supporting TKI resistance and suggest potential utility of mSWI/SNF inhibitors in TKI-resistant lung cancers.","Whole Exome Sequencing, RNA Sequencing, ATAC-Seq, CUT&RUN",,Lung,"GSE202864, GSE202863, GSE202859, GSE202857, GSE227999",Open Access,Lung Adenocarcinoma,,,37541244
PublicationView,"CA268083, CA271273",10.1016/j.cels.2023.03.004,Cell Syst,37080163,https://pubmed.ncbi.nlm.nih.gov/37080163,Uncovering the spatial landscape of molecular interactions within the tumor microenvironment through latent spaces,2023,"Spatial analysis, Tumor Microenvironment, Cell-cell Interactions, Transfer Learning, Single-cell Transcriptomics, Spatial Transcriptomics, Latent Space Factorization","Atul Deshpande, Melanie Loth, Dimitrios N Sidiropoulos, Shuming Zhang, Long Yuan, Alexander T F Bell, Qingfeng Zhu, Won Jin Ho, Cesar Santa-Maria, Daniele M Gilkes, Stephen R Williams, Cedric R Uytingco, Jennifer Chew, Andrej Hartnett, Zachary W Bent, Alexander V Favorov, Aleksander S Popel, Mark Yarchoan, Ashley Kiemen, Pei-Hsun Wu, Kohei Fujikura, Denis Wirtz, Laura D Wood, Lei Zheng, Elizabeth M Jaffee, Robert A Anders, Ludmila Danilova, Genevieve Stein-O'Brien, Luciane T Kagohara, Elana J Fertig","Recent advances in spatial transcriptomics (STs) enable gene expression measurements from a tissue sample while retaining its spatial context. This technology enables unprecedented in situ resolution of the regulatory pathways that underlie the heterogeneity in the tumor as well as the tumor microenvironment (TME). The direct characterization of cellular co-localization with spatial technologies facilities quantification of the molecular changes resulting from direct cell-cell interaction, as it occurs in tumor-immune interactions. We present SpaceMarkers, a bioinformatics algorithm to infer molecular changes from cell-cell interactions from latent space analysis of ST data. We apply this approach to infer the molecular changes from tumor-immune interactions in Visium spatial transcriptomics data of metastasis, invasive and precursor lesions, and immunotherapy treatment. Further transfer learning in matched scRNA-seq data enabled further quantification of the specific cell types in which SpaceMarkers are enriched. Altogether, SpaceMarkers can identify the location and context-specific molecular interactions within the TME from ST data.",Pending Annotation,,Pending Annotation,,Restricted Access,Pending Annotation,,,37080163
PublicationView,"CA210184, CA261694",10.1016/j.tcb.2022.09.009,Trends Cell Biol,36328835,https://pubmed.ncbi.nlm.nih.gov/36328835,Plasticity of cancer invasion and energy metabolism,2023,"Metabolic Stress, Cellular Bioenergetics, Amoeboid Migration, Migration Plasticity","Maria Parlani, Carolina Jorgez, Peter Friedl","Energy deprivation is a frequent adverse event in tumors that is caused by mutations, malperfusion, hypoxia, and nutrition deficit. The resulting bioenergetic stress leads to signaling and metabolic adaptation responses in tumor cells, secures survival, and adjusts migration activity. The kinetic responses of cancer cells to energy deficit were recently identified, including a switch of invasive cancer cells to energy-conservative amoeboid migration and an enhanced capability for distant metastasis. We review the energy programs employed by different cancer invasion modes including collective, mesenchymal, and amoeboid migration, as well as their interconversion in response to energy deprivation, and we discuss the consequences for metastatic escape. Understanding the energy requirements of amoeboid and other dissemination strategies offers rationales for improving therapeutic targeting of metastatic cancer progression.",Modeling,,Not Applicable,Not Applicable,Open Access,Pan-cancer,,,36328835
PublicationView,CA209975,10.1093/bioinformatics/btad267,Bioinformatics,37387147,https://pubmed.ncbi.nlm.nih.gov/37387147,scKINETICS: inference of regulatory velocity with single-cell transcriptomics data,2023,,"Cassandra Burdziak, Chujun Julia Zhao, Doron Haviv, Direna Alonso-Curbelo, Scott W Lowe, Dana Pe'er","Motivation: Transcriptional dynamics are governed by the action of regulatory proteins and are fundamental to systems ranging from normal development to disease. RNA velocity methods for tracking phenotypic dynamics ignore information on the regulatory drivers of gene expression variability through time. Results: We introduce scKINETICS (Key regulatory Interaction NETwork for Inferring Cell Speed), a dynamical model of gene expression change which is fit with the simultaneous learning of per-cell transcriptional velocities and a governing gene regulatory network. Fitting is accomplished through an expectation-maximization approach designed to learn the impact of each regulator on its target genes, leveraging biologically motivated priors from epigenetic data, gene-gene coexpression, and constraints on cells' future states imposed by the phenotypic manifold. Applying this approach to an acute pancreatitis dataset recapitulates a well-studied axis of acinar-to-ductal transdifferentiation whilst proposing novel regulators of this process, including factors with previously appreciated roles in driving pancreatic tumorigenesis. In benchmarking experiments, we show that scKINETICS successfully extends and improves existing velocity approaches to generate interpretable, mechanistic models of gene regulatory dynamics. Availability and implementation: All python code and an accompanying Jupyter notebook with demonstrations are available at http://github.com/dpeerlab/scKINETICS.",Mathematical Modeling,,Not Applicable,Not Applicable,Open Access,Pan-cancer,,,37387147
PublicationView,"CA209988, CA224012",10.1038/s42003-023-04837-8,Commun Biol,37142678,https://pubmed.ncbi.nlm.nih.gov/37142678,Morphodynamical cell state description via live-cell imaging trajectory embedding,2023,,"Jeremy Copperman, Sean M Gross, Young Hwan Chang, Laura M Heiser, Daniel M Zuckerman","Time-lapse imaging is a powerful approach to gain insight into the dynamic responses of cells, but the quantitative analysis of morphological changes over time remains challenging. Here, we exploit the concept of ""trajectory embedding"" to analyze cellular behavior using morphological feature trajectory histories-that is, multiple time points simultaneously, rather than the more common practice of examining morphological feature time courses in single timepoint (snapshot) morphological features. We apply this approach to analyze live-cell images of MCF10A mammary epithelial cells after treatment with a panel of microenvironmental perturbagens that strongly modulate cell motility, morphology, and cell cycle behavior. Our morphodynamical trajectory embedding analysis constructs a shared cell state landscape revealing ligand-specific regulation of cell state transitions and enables quantitative and descriptive models of single-cell trajectories. Additionally, we show that incorporation of trajectories into single-cell morphological analysis enables (i) systematic characterization of cell state trajectories, (ii) better separation of phenotypes, and (iii) more descriptive models of ligand-induced differences as compared to snapshot-based analysis. This morphodynamical trajectory embedding is broadly applicable to the quantitative analysis of cell responses via live-cell imaging across many biological and biomedical applications.",Imaging,,Breast,Not Applicable,Open Access,Breast Neoplasm,,,37142678
PublicationView,CA193417,10.1007/s00412-023-00800-y,Chromosoma,37256347,https://pubmed.ncbi.nlm.nih.gov/37256347,Genetic heterogeneity in p53-null leukemia increases transiently with spindle assembly checkpoint inhibition and is not rescued by p53,2023,"p53, Aneuploidy, Hematologic Cancer, Liquid Tumor, Spindle Assembly Check Point (Sac)","Mai Wang, Steven Phan, Brandon H Hayes, Dennis E Discher","Chromosome gains or losses often lead to copy number variations (CNV) and loss of heterozygosity (LOH). Both quantities are low in hematologic ""liquid"" cancers versus solid tumors in data of The Cancer Genome Atlas (TCGA) that also shows the fraction of a genome affected by LOH is ~ one-half of that with CNV. Suspension cultures of p53-null THP-1 leukemia-derived cells conform to these trends, despite novel evidence here of genetic heterogeneity and transiently elevated CNV after perturbation. Single-cell DNAseq indeed reveals at least 8 distinct THP-1 aneuploid clones with further intra-clonal variation, suggesting ongoing genetic evolution. Importantly, acute inhibition of the mitotic spindle assembly checkpoint (SAC) produces CNV levels that are typical of high-CNV solid tumors, with subsequent cell death and down-selection to novel CNV. Pan-cancer analyses show p53 inactivation associates with aneuploidy, but leukemias exhibit a weaker trend even though p53 inactivation correlates with poor survival. Overexpression of p53 in THP-1 does not rescue established aneuploidy or LOH but slightly increases cell death under oxidative or confinement stress, and triggers p21, a key p53 target, but without affecting net growth. Our results suggest that factors other than p53 exert stronger pressures against aneuploidy in liquid cancers, and identifying such CNV suppressors could be useful across liquid and solid tumor types.",Pending Annotation,,Pending Annotation,,Restricted Access,Pending Annotation,,,37256347
PublicationView,CA271273,10.1158/2159-8290.cd-23-0277,Cancer Discov,37067199,https://pubmed.ncbi.nlm.nih.gov/37067199,Converging on a Cure: The Roads to Predictive Immunotherapy,2023,,"Genevieve L Stein-O'Brien, Dung T Le, Elizabeth M Jaffee, Elana J Fertig, Neeha Zaidi","Summary: Convergence science teams integrating clinical, biological, engineering, and computational expertise are inventing new forecast systems to monitor and predict evolutionary changes in tumor and immune interactions during early cancer progression and therapeutic response. The resulting methods should inform a new predictive medicine paradigm to select adaptive immunotherapeutic regimens personalized to patients' tumors at a given time during their cancer progression for durable patient response.",Pending Annotation,,Pending Annotation,,Restricted Access,Pending Annotation,,,37067199
PublicationView,"CA254886, CA193417",10.1242/jcs.260753,J Cell Sci,37288769,https://pubmed.ncbi.nlm.nih.gov/37288769,"Confinement plus myosin-II suppression maximizes heritable loss of chromosomes, as revealed by live-cell ChReporters",2023,"Myosin, Heritability, Aneuploidy, Compression, Rigidity, Confinement","Brandon H Hayes, Peter Kuangzheng Zhu, Mai Wang, Charlotte R Pfeifer, Yuntao Xia, Steven Phan, Jason C Andrechak, Junhong Du, Michael P Tobin, Alisya Anlas, Lawrence J Dooling, Manasvita Vashisth, Jerome Irianto, Michael A Lampson, Dennis E Discher","The mechanical environment of a cell can have many effects, but whether it impacts the DNA sequence of a cell has remained unexamined. To investigate this, we developed a live-cell method to measure changes in chromosome numbers. We edited constitutive genes with GFP or RFP tags on single alleles and discovered that cells that lose Chromosome reporters (ChReporters) become non-fluorescent. We applied our new tools to confined mitosis and to inhibition of the putative tumor suppressor myosin-II. We quantified compression of mitotic chromatin in vivo and demonstrated that similar compression in vitro resulted in cell death, but also rare and heritable ChReptorter loss. Myosin-II suppression rescued lethal multipolar divisions and maximized ChReporter loss during three-dimensional (3D) compression and two-dimensional (2D) lateral confinement, but not in standard 2D culture. ChReporter loss was associated with chromosome mis-segregation, rather than just the number of divisions, and loss in vitro and in mice was selected against in subsequent 2D cultures. Inhibition of the spindle assembly checkpoint (SAC) caused ChReporter loss in 2D culture, as expected, but not during 3D compression, suggesting a SAC perturbation. Thus, ChReporters enable diverse studies of viable genetic changes, and show that confinement and myosin-II affect DNA sequence and mechano-evolution.",Pending Annotation,,Pending Annotation,,Restricted Access,Pending Annotation,,,37288769
PublicationView,"CA209891, CA274502",10.1016/j.ccell.2023.04.008,Cancer Cell,37146605,https://pubmed.ncbi.nlm.nih.gov/37146605,Clinical significance and biology of circulating tumor DNA in high-risk early-stage HER2-negative breast cancer receiving neoadjuvant chemotherapy,2023,"receptor subtype, Neoadjuvant chemotherapy, Gene Expression, Pathologic Complete Response, Circulating Tumor Dna, Residual Cancer Burden","Mark Jesus M Magbanua, Lamorna Brown Swigart, Ziad Ahmed, Rosalyn W Sayaman, Derrick Renner, Ekaterina Kalashnikova, Gillian L Hirst, Christina Yau, Denise M Wolf, Wen Li, Amy L Delson, Smita Asare, Minetta C Liu, Kathy Albain, A Jo Chien, Andres Forero-Torres, Claudine Isaacs, Rita Nanda, Debu Tripathy, Angel Rodriguez, Himanshu Sethi, Alexey Aleshin, Matthew Rabinowitz, Jane Perlmutter, W Fraser Symmans, Douglas Yee, Nola M Hylton, Laura J Esserman, Angela M DeMichele, Hope S Rugo, Laura J van 't Veer","Circulating tumor DNA (ctDNA) analysis may improve early-stage breast cancer treatment via non-invasive tumor burden assessment. To investigate subtype-specific differences in the clinical significance and biology of ctDNA shedding, we perform serial personalized ctDNA analysis in hormone receptor (HR)-positive/HER2-negative breast cancer and triple-negative breast cancer (TNBC) patients receiving neoadjuvant chemotherapy (NAC) in the I-SPY2 trial. ctDNA positivity rates before, during, and after NAC are higher in TNBC than in HR-positive/HER2-negative breast cancer patients. Early clearance of ctDNA 3 weeks after treatment initiation predicts a favorable response to NAC in TNBC only. Whereas ctDNA positivity associates with reduced distant recurrence-free survival in both subtypes. Conversely, ctDNA negativity after NAC correlates with improved outcomes, even in patients with extensive residual cancer. Pretreatment tumor mRNA profiling reveals associations between ctDNA shedding and cell cycle and immune-associated signaling. On the basis of these findings, the I-SPY2 trial will prospectively test ctDNA for utility in redirecting therapy to improve response and prognosis.",Cell-free Circulating Tumor DNA Assay,,Breast,GSE194040,Open Access,Breast Carcinoma,,,37146605
PublicationView,CA209975,10.1126/science.add5327,Science,37167403,https://pubmed.ncbi.nlm.nih.gov/37167403,Epigenetic plasticity cooperates with cell-cell interactions to direct pancreatic tumorigenesis,2023,,"Cassandra Burdziak, Direna Alonso-Curbelo, Thomas Walle, José Reyes, Francisco M Barriga, Doron Haviv, Yubin Xie, Zhen Zhao, Chujun Julia Zhao, Hsuan-An Chen, Ojasvi Chaudhary, Ignas Masilionis, Zi-Ning Choo, Vianne Gao, Wei Luan, Alexandra Wuest, Yu-Jui Ho, Yuhong Wei, Daniela F Quail, Richard Koche, Linas Mazutis, Ronan Chaligné, Tal Nawy, Scott W Lowe, Dana Pe'er","The response to tumor-initiating inflammatory and genetic insults can vary among morphologically indistinguishable cells, suggesting as yet uncharacterized roles for epigenetic plasticity during early neoplasia. To investigate the origins and impact of such plasticity, we performed single-cell analyses on normal, inflamed, premalignant, and malignant tissues in autochthonous models of pancreatic cancer. We reproducibly identified heterogeneous cell states that are primed for diverse, late-emerging neoplastic fates and linked these to chromatin remodeling at cell-cell communication loci. Using an inference approach, we revealed signaling gene modules and tissue-level cross-talk, including a neoplasia-driving feedback loop between discrete epithelial and immune cell populations that was functionally validated in mice. Our results uncover a neoplasia-specific tissue-remodeling program that may be exploited for pancreatic cancer interception.",Pending Annotation,,Pending Annotation,,Restricted Access,Pending Annotation,,,37167403
PublicationView,"CA209988, CA224012",10.1038/s42003-023-04837-8,Commun Biol,37142678,https://pubmed.ncbi.nlm.nih.gov/37142678,Morphodynamical cell state description via live-cell imaging trajectory embedding,2023,,"Jeremy Copperman, Sean M Gross, Young Hwan Chang, Laura M Heiser, Daniel M Zuckerman","Time-lapse imaging is a powerful approach to gain insight into the dynamic responses of cells, but the quantitative analysis of morphological changes over time remains challenging. Here, we exploit the concept of ""trajectory embedding"" to analyze cellular behavior using morphological feature trajectory histories-that is, multiple time points simultaneously, rather than the more common practice of examining morphological feature time courses in single timepoint (snapshot) morphological features. We apply this approach to analyze live-cell images of MCF10A mammary epithelial cells after treatment with a panel of microenvironmental perturbagens that strongly modulate cell motility, morphology, and cell cycle behavior. Our morphodynamical trajectory embedding analysis constructs a shared cell state landscape revealing ligand-specific regulation of cell state transitions and enables quantitative and descriptive models of single-cell trajectories. Additionally, we show that incorporation of trajectories into single-cell morphological analysis enables (i) systematic characterization of cell state trajectories, (ii) better separation of phenotypes, and (iii) more descriptive models of ligand-induced differences as compared to snapshot-based analysis. This morphodynamical trajectory embedding is broadly applicable to the quantitative analysis of cell responses via live-cell imaging across many biological and biomedical applications.","Mathematical Modeling, Imaging",,Not Applicable,,Open Access,Pan-cancer,,,37142678
