Component,Publication Grant Number,Publication Doi,Publication Journal,Pubmed Id,Pubmed Url,Publication Title,Publication Year,Publication Keywords,Publication Authors,Publication Abstract,Publication Assay,Publication Tumor Type,Publication Tissue,Publication Dataset Alias,Publication Accessibility,PublicationView_id
PublicationView,CA256054,10.1002/jbm.a.37621,J Biomed Mater Res A,37772330,https://pubmed.ncbi.nlm.nih.gov/37772330,TRAIL-conjugated liposomes that bind natural killer cells to induce colorectal cancer cell apoptosis,2023,"Liposomes, TRAIL, Natural killer cells, lymphatics","Joshua D Greenlee, Zhenjiang Zhang, Tejas Subramanian, Kevin Liu, Michael R King","Natural killer (NK) cell functionality is a strong indicator of favorable prognosis in cancer patients, making NK cells an appealing therapeutic target to prevent lymph node dissemination. We engineered liposomes that are conjugated with anti-CD335 antibodies for NK cell targeting, and the apoptotic ligand TRAIL to kill cancer cells. Liposomes were made using a thin film hydration method followed by extrusion to approximately 100 nm in diameter and conjugation of proteins via thiol-maleimide click chemistry. TRAIL/anti-CD335 liposomes successfully bound to isolated NK cells. Once piggybacked to the surface of NK cells, these ""Super Natural Killer Cells"" were able to more effectively kill oxaliplatin-resistant SW620 cells and metastatic COLO205 colorectal cancer cells via TRAIL-mediated apoptosis compared to NK cells alone. Importantly, Super NK cells were more effective under physiological levels of fluid shear stress found in the lymphatics. Liposome biodistribution after intravenous administration confirmed the sustained presence of liposomes within the spleen and tumor draining mesenteric lymph nodes for at least 4 days. These results demonstrate the enhanced apoptotic effects of NK cells armored with liposomal TRAIL against clinically relevant colorectal cancer cells, providing the groundwork for in vivo treatment studies in mouse models of colorectal cancer metastasis.","Cell Culture, Scanning Electron Microscopy",Colorectal Neoplasm,"Intestine, Colon",Not Applicable,Open Access,37772330
PublicationView,"CA264620, CA209978",10.7554/elife.85898,Elife,37772709,https://pubmed.ncbi.nlm.nih.gov/37772709,ONC201/TIC10 enhances durability of mTOR inhibitor everolimus in metastatic ER+ breast cancer,2023,"Human, Mitochondria, Drug resistance, Breast cancer, Stress response, Everolimus, Cancer Biology, Onc201/Tic10","Elena Farmaki, Aritro Nath, Rena Emond, Kimya L Karimi, Vince K Grolmusz, Patrick A Cosgrove, Andrea H Bild","The mTOR inhibitor, everolimus, is an important clinical management component of metastatic ER+ breast cancer (BC). However, most patients develop resistance and progress on therapy, highlighting the need to discover strategies that increase mTOR inhibitor effectiveness. We developed ER+ BC cell lines, sensitive or resistant to everolimus, and discovered that combination treatment of ONC201/TIC10 with everolimus inhibited cell growth in 2D/3D in vitro studies. We confirmed increased therapeutic response in primary patient cells progressing on everolimus, supporting clinical relevance. We show that ONC201/TIC10 mechanism in metastatic ER+ BC cells involves oxidative phosphorylation inhibition and stress response activation. Transcriptomic analysis in everolimus resistant breast patient tumors and mitochondrial functional assays in resistant cell lines demonstrated increased mitochondrial respiration dependency, contributing to ONC201/TIC10 sensitivity. We propose that ONC201/TIC10 and modulation of mitochondrial function may provide an effective add-on therapy strategy for patients with metastatic ER+ BCs resistant to mTOR inhibitors.","Cell Culture, Western Blotting, RNA Sequencing","Breast Adenocarcinoma, Breast Carcinoma, Invasive Ductal Breast Carcinoma",Breast,"GSE119262,  GSE212369",Open Access,37772709
PublicationView,CA217514,10.1158/2767-9764.crc-23-0109,Cancer Res Commun,37772998,https://pubmed.ncbi.nlm.nih.gov/37772998,Effects and Eradication of Mycoplasma Contamination on Patient-derived Colorectal Cancer Organoid Cultures,2023,,"Divya L Dayanidhi, Wylie K Watlington, John B Mantyh, Gabrielle Rupprecht, David S Hsu","Significance: Organoids are valuable models of cancer. Mycoplasma contamination can alter organoid drug sensitivity, so there is a need for a standardized protocol to detect and remove Mycoplasma from organoids. We report a simple procedure for removing Mycoplasma from organoids via in vivo passaging through mice followed by re-establishment of organoids.","Organoid, Modeling",Colorectal Neoplasm,Colon,Not Applicable,Open Access,37772998
PublicationView,CA225566,10.1016/j.bpj.2023.01.005,Biophys J,36617192,https://pubmed.ncbi.nlm.nih.gov/36617192,Rho activation drives luminal collapse and eversion in epithelial acini,2023,,"Vani Narayanan, Purboja Purkayastha, Bo Yu, Kavya Pendyala, Sasanka Chukkapalli, Jolene I Cabe, Richard B Dickinson, Daniel E Conway, Tanmay P Lele","Epithelial cells lining a gland and cells grown in a soft extracellular matrix polarize with apical proteins exposed to the lumen and basal proteins in contact with the extracellular matrix. Alterations to polarity, including an apical-out polarity, occur in human cancers. Although some aberrant polarity states may result from altered protein trafficking, recent observations of an extraordinary tissue-level inside-out unfolding suggest an alternative pathway for altered polarity. Because mechanical alterations are common in human cancer, including an upregulation of RhoA-mediated actomyosin tension in acinar epithelia, we explored whether perturbing mechanical homeostasis could cause apical-out eversion. Acinar eversion was robustly induced by direct activation of RhoA in normal and tumor epithelial acini, or indirect activation of RhoA through blockage of β1-integrins, disruption of the LINC complex, oncogenic Ras activation, or Rac1 inhibition. Furthermore, laser ablation of a portion of the untreated acinus was sufficient to induce eversion. Analyses of acini revealed high curvature and low phosphorylated myosin in the apical cell surfaces relative to the basal surfaces. A vertex-based mathematical model that balances tension at cell-cell interfaces revealed a fivefold greater basal cell surface tension relative to the apical cell surface tension. The model suggests that the difference in surface energy between the apical and basal surfaces is the driving force for acinar eversion. Our findings raise the possibility that a loss of mechanical homeostasis may cause apical-out polarity states in human cancers.",Pending Annotation,Pending Annotation,Pending Annotation,,Restricted Access,36617192
PublicationView,CA217377,10.1038/s41586-023-05940-w,Nature,37076617,https://pubmed.ncbi.nlm.nih.gov/37076617,PI3Kβ controls immune evasion in PTEN-deficient breast tumours,2023,,"Johann S Bergholz, Qiwei Wang, Qi Wang, Michelle Ramseier, Sanjay Prakadan, Weihua Wang, Rong Fang, Sheheryar Kabraji, Qian Zhou, G Kenneth Gray, Kayley Abell-Hart, Shaozhen Xie, Xiaocan Guo, Hao Gu, Thanh Von, Tao Jiang, Shuang Tang, Gordon J Freeman, Hye-Jung Kim, Alex K Shalek, Thomas M Roberts, Jean J Zhao","Loss of the PTEN tumour suppressor is one of the most common oncogenic drivers across all cancer types<sup>1</sup>. PTEN is the major negative regulator of PI3K signalling. The PI3Kβ isoform has been shown to play an important role in PTEN-deficient tumours, but the mechanisms underlying the importance of PI3Kβ activity remain elusive. Here, using a syngeneic genetically engineered mouse model of invasive breast cancer driven by ablation of both Pten and Trp53 (which encodes p53), we show that genetic inactivation of PI3Kβ led to a robust anti-tumour immune response that abrogated tumour growth in syngeneic immunocompetent mice, but not in immunodeficient mice. Mechanistically, PI3Kβ inactivation in the PTEN-null setting led to reduced STAT3 signalling and increased the expression of immune stimulatory molecules, thereby promoting anti-tumour immune responses. Pharmacological PI3Kβ inhibition also elicited anti-tumour immunity and synergized with immunotherapy to inhibit tumour growth. Mice with complete responses to the combined treatment displayed immune memory and rejected tumours upon re-challenge. Our findings demonstrate a molecular mechanism linking PTEN loss and STAT3 activation in cancer and suggest that PI3Kβ controls immune escape in PTEN-null tumours, providing a rationale for combining PI3Kβ inhibitors with immunotherapy for the treatment of PTEN-deficient breast cancer.",Pending Annotation,Pending Annotation,Pending Annotation,"SRX19333312, SRX19333246, SRX19333238, SRX19333274, SRX19333276, SRP421642, SRX19333287, SRX19333298, SRX19333277, SRX19333245, SRX19333322, SRX19333289, SRX19333317, SRX19333290, GSE225064, SRX19320393, SRX19333275, SRX19333252, SRX19320391, SRX19333321, SRX19320392, SRX19333331, SRX19333330, SRX19320397, SRX19333253, SRX19333291, SRX19333278, SRX19333259, SRX19333311, SRX19333244, SRX19333248, SRX19333286, SRX19333307, SRX19333247, SRX19333269, SRX19333236, SRX19333306, SRX19333262, SRX19333280, SRX19333283, SRX19333301, SRX19333293, SRX19333279, SRX19333323, SRX19320398, SRX19333241, SRX19333250, SRX19333242, SRX19333296, SRX19333320, SRX19333268, SRX19333325, SRX19333303, SRX19333272, SRP421879, SRX19333313, SRX19333234, SRX19333232, SRX19333314, SRX19333235, SRX19333261, SRX19333294, SRX19333233, SRX19333254, SRX19333315, SRX19333329, SRX19333255, SRX19333305, SRX19333270, SRX19333299, SRX19333230, SRX19333257, SRX19333326, SRX19333281, SRX19333284, SRX19333304, SRX19333243, SRX19333309, SRX19333266, SRX19333240, SRX19333300, SRX19333302, SRX19333263, GSE224906, SRX19333249, SRX19333237, SRX19333239, SRX19333267, SRX19333316, SRX19333271, SRX19333318, SRX19333258, SRX19333310, SRX19333229, SRX19333308, SRX19333324, SRX19333292, SRX19320390, SRX19333251, SRX19333328, SRX19320395, SRX19333288, SRX19333319, SRX19333285, SRX19333256, SRX19333265, SRX19333231, SRX19333327, SRX19320396, SRX19320394, SRX19333297, SRX19333264, SRX19333282, SRX19333295, SRX19333273, SRX19333260",Restricted Access,37076617
PublicationView,CA210173,10.1016/j.matbio.2023.06.002,Matrix Biol,37331435,https://pubmed.ncbi.nlm.nih.gov/37331435,Collagen VI deposition mediates stromal T cell trapping through inhibition of T cell motility in the prostate tumor microenvironment,2023,"T cells, prostate cancer, Collagen Vi","Hawley C Pruitt, Ya Guan, Hudson Liu, Alexis E Carey, W Nathaniel Brennen, Jiayun Lu, Corrine Joshu, Ashani Weeraratna, Tamara L Lotan, T S Karin Eisinger-Mathason, Sharon Gerecht","The tumor extracellular matrix (ECM) is a barrier to anti-tumor immunity in solid tumors by disrupting T cell-tumor cell interaction underlying the need for elucidating mechanisms by which specific ECM proteins impact T cell motility and activity within the desmoplastic stroma of solid tumors. Here, we show that Collagen VI (Col VI) deposition correlates with stromal T cell density in human prostate cancer specimens. Furthermore, motility of CD4+ T cells is completely ablated on purified Col VI surfaces when compared with Fibronectin and Collagen I. Importantly, T cells adhered to Col VI surfaces displayed reduced cell spreading and fibrillar actin, indicating a reduction in traction force generation accompanied by a decrease in integrin β1 clustering. We found that CD4+ T cells largely lack expression of integrin α1 in the prostate tumor microenvironment and that blockade of α1β1 integrin heterodimers inhibited CD8+ T cell motility on prostate fibroblast-derived matrix, while re-expression of ITGA1 improved motility. Taken together, we show that the Col VI-rich microenvironment in prostate cancer reduces the motility of CD4+ T cells lacking integrin α1, leading to their accumulation in the stroma, thus putatively inhibiting anti-tumor T cell responses.",Pending Annotation,Pending Annotation,Pending Annotation,,Restricted Access,37331435
PublicationView,CA261701,10.1158/0008-5472.can-23-1252,Cancer Res,37335131,https://pubmed.ncbi.nlm.nih.gov/37335131,Apolipoprotein E2 Stimulates Protein Synthesis and Promotes Melanoma Progression and Metastasis,2023,,"Nneoma Adaku, Benjamin N Ostendorf, Wenbin Mei, Sohail F Tavazoie","The secreted lipid transporter apolipoprotein E (APOE) plays important roles in atherosclerosis and Alzheimer's disease and has been implicated as a suppressor of melanoma progression. The APOE germline genotype predicts human melanoma outcomes, with APOE4 and APOE2 allele carriers exhibiting prolonged and reduced survival, respectively, relative to APOE3 homozygotes. While the APOE4 variant was recently shown to suppress melanoma progression by enhancing antitumor immunity, further work is needed to fully characterize the melanoma cell-intrinsic effects of APOE variants on cancer progression. Using a genetically engineered mouse model, we showed that human germline APOE genetic variants differentially modulate melanoma growth and metastasis in an APOE2>APOE3>APOE4 manner. The low-density lipoprotein receptor-related protein 1 (LRP1) receptor mediated the cell-intrinsic effects of APOE variants on melanoma progression. Protein synthesis was a tumor cell-intrinsic process differentially modulated by APOE variants, with APOE2 promoting translation via LRP1. These findings reveal a gain-of-function role for the APOE2 variant in melanoma progression, which may aid in predicting melanoma patient outcomes and understanding the protective effect of APOE2 in Alzheimer's disease. Significance: APOE germline variants impact melanoma progression through disparate mechanisms, such as the protein synthesis-promoting function of the APOE2 variant, indicating that germline genetic variants are causal contributors to metastatic outcomes.",Pending Annotation,Pending Annotation,Pending Annotation,"SRX16372750, SRX16372761, SRX16372755, SRX16372760, SRX16372757, SRX16372759, SRX16372756, SRP387385, GSE209873, SRX16372753, SRX16372751, SRX16372749, SRX16372752, SRX16372754, SRX16372758, GSE208718",Restricted Access,37335131
PublicationView,CA268084,10.1021/acs.nanolett.3c00852,Nano Lett,37463268,https://pubmed.ncbi.nlm.nih.gov/37463268,Investigating Uncertainties in Single-Molecule Localization Microscopy Using Experimentally Informed Monte Carlo Simulation,2023,"Image processing, Nuclear pore complex, Monte Carlo simulation, Single-molecule Localization Microscopy","Wei-Hong Yeo, Yang Zhang, Amy E Neely, Xiaomin Bao, Cheng Sun, Hao F Zhang","Single-molecule localization microscopy (SMLM) enables the visualization of cellular nanostructures <i>in vitro</i> with sub-20 nm resolution. While substructures can generally be imaged with SMLM, the structural understanding of the images remains elusive. To better understand the link between SMLM images and the underlying structure, we developed a Monte Carlo (MC) simulation based on experimental imaging parameters and geometric information to generate synthetic SMLM images. We chose the nuclear pore complex (NPC), a nanosized channel on the nuclear membrane which gates nucleo-cytoplasmic transport of biomolecules, as a test geometry for testing our MC model. Using the MC model to simulate SMLM images, we first optimized our clustering algorithm to separate >10<sup>6</sup> molecular localizations of fluorescently labeled NPC proteins into hundreds of individual NPCs in each cell. We then illustrated using our MC model to generate cellular substructures with different angles of labeling to inform our structural understanding through the SMLM images obtained.",Pending Annotation,Pending Annotation,Pending Annotation,,Restricted Access,37463268
PublicationView,CA249799,10.1016/j.biomaterials.2023.122267,Biomaterials,37633022,https://pubmed.ncbi.nlm.nih.gov/37633022,Modeling and countering the effects of cosmic radiation using bioengineered human tissues,2023,"Bone marrow, Heart, Radiation, Tissue engineering, Organs On Chip, Space Health","Daniel Naveed Tavakol, Trevor R Nash, Youngbin Kim, Siyu He, Sharon Fleischer, Pamela L Graney, Jessie A Brown, Martin Liberman, Manuel Tamargo, Andrew Harken, Adolfo A Ferrando, Sally Amundson, Guy Garty, Elham Azizi, Kam W Leong, David J Brenner, Gordana Vunjak-Novakovic","Cosmic radiation is the most serious risk that will be encountered during the planned missions to the Moon and Mars. There is a compelling need to understand the effects, safety thresholds, and mechanisms of radiation damage in human tissues, in order to develop measures for radiation protection during extended space travel. As animal models fail to recapitulate the molecular changes in astronauts, engineered human tissues and ""organs-on-chips"" are valuable tools for studying effects of radiation in vitro. We have developed a bioengineered tissue platform for studying radiation damage in individualized settings. To demonstrate its utility, we determined the effects of radiation using engineered models of two human tissues known to be radiosensitive: engineered cardiac tissues (eCT, a target of chronic radiation damage) and engineered bone marrow (eBM, a target of acute radiation damage). We report the effects of high-dose neutrons, a proxy for simulated galactic cosmic rays, on the expression of key genes implicated in tissue responses to ionizing radiation, phenotypic and functional changes in both tissues, and proof-of-principle application of radioprotective agents. We further determined the extent of inflammatory, oxidative stress, and matrix remodeling gene expression changes, and found that these changes were associated with an early hypertrophic phenotype in eCT and myeloid skewing in eBM. We propose that individualized models of human tissues have potential to provide insights into the effects and mechanisms of radiation during deep-space missions and allow testing of radioprotective measures.",Pending Annotation,Pending Annotation,Pending Annotation,,Restricted Access,37633022
PublicationView,CA253472,10.1016/j.tig.2023.07.005,Trends Genet,37658004,https://pubmed.ncbi.nlm.nih.gov/37658004,Single-cell dissection of tumor microenvironmental response and resistance to cancer therapy,2023,"Combination therapy, Tumor Microenvironment, Therapeutic Response, Single-cell Genomics","Yikai Luo, Han Liang","Cancer treatment strategies have evolved significantly over the years, with chemotherapy, targeted therapy, and immunotherapy as major pillars. Each modality leads to unique treatment outcomes by interacting with the tumor microenvironment (TME), which imposes a fundamental selective pressure on cancer progression. The advent of single-cell profiling technologies has revolutionized our understanding of the intricate and heterogeneous nature of the TME at an unprecedented resolution. This review delves into the commonalities and differential manifestations of how cancer therapies reshape the microenvironment in diverse cancer types. We highlight how groundbreaking immune checkpoint blockade (ICB) strategies alone or in combination with tumor-targeting treatments are endowed with comprehensive mechanistic insights when decoded at the single-cell level, aiming to drive forward future research directions on personalized treatments.",Pending Annotation,Pending Annotation,Pending Annotation,,Restricted Access,37658004
PublicationView,CA274492,,Proc Mach Learn Res,37681192,https://pubmed.ncbi.nlm.nih.gov/37681192,DIET: Conditional independence testing with marginal dependence measures of residual information,2023,,"Mukund Sudarshan, Aahlad Puli, Wesley Tansey, Rajesh Ranganath","Conditional randomization tests (CRTs) assess whether a variable x is predictive of another variable y, having observed covariates z. CRTs require fitting a large number of predictive models, which is often computationally intractable. Existing solutions to reduce the cost of CRTs typically split the dataset into a train and test portion, or rely on heuristics for interactions, both of which lead to a loss in power. We propose the decoupled independence test (DIET), an algorithm that avoids both of these issues by leveraging marginal independence statistics to test conditional independence relationships. DIET tests the marginal independence of two random variables: Fx∣z(x∣z) and Fy∣z(y∣z) where F⋅∣z(⋅∣z) is a conditional cumulative distribution function (CDF) for the distribution p(⋅∣z). These variables are termed ""information residuals."" We give sufficient conditions for DIET to achieve finite sample type-1 error control and power greater than the type-1 error rate. We then prove that when using the mutual information between the information residuals as a test statistic, DIET yields the most powerful conditionally valid test. Finally, we show DIET achieves higher power than other tractable CRTs on several synthetic and real benchmarks.",Pending Annotation,Pending Annotation,Pending Annotation,,Restricted Access,37681192
PublicationView,CA209975,10.1038/s41587-023-01967-6,Nat Biotechnol,37735267,https://pubmed.ncbi.nlm.nih.gov/37735267,Decoding the building blocks of cellular processes from single-cell transcriptomics data,2023,,,No abstract available.,Pending Annotation,Pending Annotation,Pending Annotation,,Restricted Access,37735267